title,price,brand,type,transmission,milage,fuel,location,years,milage_class
toyota yaris,275000000,toyota,1.5 TRD Sportivo Bensin,Automatic Triptonic,5.000-10.000,Bensin,"Telukjambe Timur, Karawang Kab., Jawa Barat",2021,2
toyota yaris,260000000,toyota,Lain-lain,Automatic,5.000-10.000,Bensin,"Bekasi Timur, Bekasi Kota, Jawa Barat",2021,2
toyota yaris,264000000,toyota,1.5 TRD Sportivo Bensin,Automatic,20.000-25.000,Bensin,"Candi, Sidoarjo  Kab., Jawa Timur",2021,5
toyota yaris,260000000,toyota,1.5 TRD Sportivo Heykers Bensin,Automatic,15.000-20.000,Bensin,"Kelapa Dua, Tangerang Kab., Banten",2021,4
toyota yaris,285000000,toyota,Lain-lain,Automatic Triptonic,10.000-15.000,Bensin,"Purwokerto Barat, Banyumas Kab., Jawa Tengah",2021,3
toyota yaris,252500000,toyota,1.5 TRD Sportivo Bensin,Manual,10.000-15.000,Bensin,"Astana Anyar, Bandung Kota, Jawa Barat",2021,3
toyota yaris,269000000,toyota,1.5 TRD Sportivo Bensin,Automatic Triptonic,0-5.000,Bensin,"Karawang Barat, Karawang Kab., Jawa Barat",2021,1
toyota yaris,268000000,toyota,1.5 TRD Sportivo Bensin,Automatic,0-5.000,Bensin,"Pademangan, Jakarta Utara, Jakarta D.K.I.",2021,1
toyota yaris,225000000,toyota,1.5 TRD Sportivo Bensin,Automatic,85.000-90.000,Bensin,"Kelapa Dua, Tangerang Kab., Banten",2020,18
toyota yaris,285000000,toyota,1.5 TRD Sportivo Bensin,Automatic Triptonic,5.000-10.000,Bensin,"Magelang Selatan, Magelang Kota, Jawa Tengah",2020,2
toyota yaris,236500000,toyota,1.5 TRD Sportivo Bensin,Automatic,5.000-10.000,Bensin,"Pondok Aren, Tangerang Selatan Kota, Banten",2020,2
toyota yaris,232000000,toyota,1.5 TRD Sportivo Bensin,Manual,5.000-10.000,Bensin,"Balaraja, Tangerang Kab., Banten",2020,2
toyota yaris,268000000,toyota,1.5 TRD Sportivo Bensin,Automatic Triptonic,20.000-25.000,Bensin,"Sukun, Malang Kota, Jawa Timur",2020,5
toyota yaris,246000000,toyota,1.5 TRD Sportivo Bensin,Automatic,20.000-25.000,Bensin,"Pademangan, Jakarta Utara, Jakarta D.K.I.",2020,5
toyota yaris,240000000,toyota,1.5 TRD Sportivo Bensin,Automatic,15.000-20.000,Bensin,"Bekasi Selatan, Bekasi Kota, Jawa Barat",2020,4
toyota yaris,238000000,toyota,1.5 TRD Sportivo Bensin,Manual,15.000-20.000,Bensin,"Jl Brigjen sudiarto rt 01 rw 01 kel penggaron kidul kec pedurungan kota semarang jawa tengah, penggaron kidul, kec pedurungan, kota semarang, Jawa tengahDapatkan petunjuk",2020,4
toyota yaris,231000000,toyota,1.5 TRD Sportivo Bensin,Automatic,15.000-20.000,Bensin,"Jl Brigjen sudiarto rt 01 rw 01 kel penggaron kidul kec pedurungan kota semarang jawa tengah, penggaron kidul, kec pedurungan, kota semarang, Jawa tengahDapatkan petunjuk",2020,4
toyota yaris,123000000,toyota,1.5 S Limited Bensin,Automatic,105.000-110.000,Bensin,"Jagakarsa, Jakarta Selatan, Jakarta D.K.I.",2020,22
toyota yaris,252000000,toyota,1.5 TRD Sportivo Bensin,Automatic,10.000-15.000,Bensin,"Jl. Jend. Sudirman No.573, Sukahaji, Kec. Babakan Ciparay, Kota Bandung, Jawa Barat 40221, Sukahaji, Kecamatan Babakan ciparay, Bandung, Jawa BaratDapatkan petunjuk",2020,3
toyota yaris,245000000,toyota,1.5 TRD Sportivo Bensin,Automatic,10.000-15.000,Bensin,"Bella Terra Lifestyle, Jl. Boulevard Raya No.kav 1, Klp. Gading Tim., 14240, Kelapa Gading, Kecamatan Kelapa Gading, Jakarta Utara, DKI JakartaDapatkan petunjuk",2020,3
toyota yaris,180000000,toyota,1.5 TRD Sportivo Bensin,Automatic,0-5.000,Bensin,"Gubeng, Surabaya Kota, Jawa Timur",2020,1
toyota yaris,205000000,toyota,1.5 G Bensin,Automatic,60.000-65.000,Bensin,"Jl Kembangan selatan no 10-11 Kembangan Jakbar, Kembangan, Kembangan, Jakarta Barat, DKI JakartaDapatkan petunjuk",2019,13
toyota yaris,253000000,toyota,1.5 TRD Sportivo Bensin,Automatic,50.000-55.000,Bensin,"Jl. Baruk Utara IX, Perumahan Pondok Nirwana No.34. Kedung Baruk, Kec. Rungkut, Surabaya, Jawa TImur, 60298, Kedung Baruk, Kec. Rungkut, Surabaya Kota, Jawa TimurDapatkan petunjuk",2019,11
toyota yaris,249000000,toyota,1.5 TRD Sportivo Bensin,Automatic,5.000-10.000,Bensin,"Jl. Barata Jaya XIX No.36, Baratajaya, Kec. Gubeng, Kota SBY, Jawa Timur 60284, Barata Jaya, Kec. Gubeng, Surabaya, Jawa TimurDapatkan petunjuk",2019,2
toyota yaris,215000000,toyota,1.5 TRD Sportivo Bensin,Automatic,45.000-50.000,Bensin,"Jl. Ring Road Utara No.3 F, Ngringin, Condongcatur, Kec. Depok, Kabupaten Sleman, Daerah Istimewa Yogyakarta 55283, Condongcatur, Kec. Depok, Kab. Sleman, DI YogyakartaDapatkan petunjuk",2019,10
toyota yaris,235000000,toyota,TRD Sportivo TRD M/T,Manual,30.000-35.000,Bensin,"Bondowoso, Bondowoso Kab., Jawa Timur",2019,7
toyota yaris,226000000,toyota,1.5 TRD Sportivo Bensin,Manual,30.000-35.000,Bensin,"Jl. Jend. Sudirman No.573, Sukahaji, Kec. Babakan Ciparay, Kota Bandung, Jawa Barat 40221, Sukahaji, Kecamatan Babakan ciparay, Bandung, Jawa BaratDapatkan petunjuk",2019,7
toyota yaris,248000000,toyota,1.5 TRD Sportivo Bensin,Automatic,25.000-30.000,Bensin,"Bekasi Barat, Bekasi Kota, Jawa Barat",2019,6
toyota yaris,239000000,toyota,1.5 TRD Sportivo Bensin,Automatic,25.000-30.000,Bensin,"Carsworld Building, Lengkong Gudang, Serpong, Kecamatan Serpong, BSD, BantenDapatkan petunjuk",2019,6
toyota yaris,210000000,toyota,1.5 G Bensin,Automatic,20.000-25.000,Bensin,"Pasar Mobil Kemayoran Blok S 39 - 43 dan S 78, Kemayoran, Kecamatan Pademangan, Jakarta Utara, DKI JakartaDapatkan petunjuk",2019,5
toyota yaris,235000000,toyota,1.5 TRD Sportivo Bensin,Automatic Triptonic,15.000-20.000,Bensin,"Kelapa Dua, Tangerang Kab., Banten",2019,4
toyota yaris,222000000,toyota,1.5 TRD Sportivo Bensin,Manual,10.000-15.000,Bensin,"Karawaci, Tangerang Kota, Banten",2019,3
toyota yaris,229000000,toyota,1.5 TRD Sportivo Bensin,Automatic Triptonic,0-5.000,Bensin,"Semarang Selatan, Semarang Kota, Jawa Tengah",2019,1
toyota yaris,217000000,toyota,1.5 TRD Sportivo Bensin,Automatic,85.000-90.000,Bensin,"Karawang Barat, Karawang Kab., Jawa Barat",2018,18
toyota yaris,215000000,toyota,1.5 TRD Sportivo Bensin,Automatic,70.000-75.000,Bensin,"Kelapa Dua, Tangerang Kab., Banten",2018,15
toyota yaris,207000000,toyota,1.5 TRD Sportivo Bensin,Automatic,60.000-65.000,Bensin,"Cibodas, Tangerang Kota, Banten",2018,13
toyota yaris,243000000,toyota,1.5 S Bensin,Automatic,5.000-10.000,Bensin,"Semampir, Surabaya Kota, Jawa Timur",2018,2
toyota yaris,233000000,toyota,1.5 TRD Sportivo Bensin,Automatic,5.000-10.000,Bensin,"Regol, Bandung Kota, Jawa Barat",2018,2
toyota yaris,230000000,toyota,1.5 TRD Sportivo Bensin,Automatic,45.000-50.000,Bensin,"jl Ronggowarsito no 130 Timuran banjarsari Surakarta solo, Solo, Banjarsari, Solo, Jawa TengahDapatkan petunjuk",2018,10
toyota yaris,227000000,toyota,1.5 TRD Sportivo Bensin,Automatic,45.000-50.000,Bensin,"jl Ronggowarsito no 130 Timuran banjarsari Surakarta solo, Solo, Banjarsari, Solo, Jawa TengahDapatkan petunjuk",2018,10
toyota yaris,239000000,toyota,1.5 TRD Sportivo Bensin,Automatic Triptonic,40.000-45.000,Bensin,"Kediri Kota, Kediri Kota, Jawa Timur",2018,9
toyota yaris,219500000,toyota,1.5 TRD Sportivo Bensin,Automatic Triptonic,40.000-45.000,Bensin,"Cinere, Depok Kota, Jawa Barat",2018,9
toyota yaris,202000000,toyota,1.5 TRD Sportivo Bensin,Manual,35.000-40.000,Bensin,"Cimahi Selatan, Cimahi Kota, Jawa Barat",2018,8
toyota yaris,225000000,toyota,1.5 TRD Sportivo Bensin,Automatic,30.000-35.000,Bensin,"Bekasi Barat, Bekasi Kota, Jawa Barat",2018,7
toyota yaris,220000000,toyota,1.5 TRD Sportivo Bensin,Automatic,10.000-15.000,Bensin,"Kelapa Dua, Tangerang Kab., Banten",2018,3
toyota yaris,155000000,toyota,1.5 E Bensin,Automatic,70.000-75.000,Bensin,"Serpong, Tangerang Selatan Kota, Banten",2017,15
toyota yaris,185000000,toyota,1.5 TRD Sportivo Bensin,Automatic,65.000-70.000,Bensin,"Semarang Tengah, Semarang Kota, Jawa Tengah",2017,14
toyota yaris,179900000,toyota,1.5 TRD Sportivo Bensin,Manual,65.000-70.000,Bensin,"Gubeng, Surabaya Kota, Jawa Timur",2017,14
toyota yaris,179000000,toyota,1.5 TRD Sportivo Bensin,Automatic Triptonic,65.000-70.000,Bensin,"Semarang Tengah, Semarang Kota, Jawa Tengah",2017,14
toyota yaris,177500000,toyota,1.5 TRD Sportivo Heykers Bensin,Manual,65.000-70.000,Bensin,"Tingkir, Salatiga Kota, Jawa Tengah",2017,14
toyota yaris,170000000,toyota,Heykers,Manual,65.000-70.000,Bensin,"Sukoharjo, Sukoharjo Kab., Jawa Tengah",2017,14
toyota yaris,195000000,toyota,1.5 TRD Sportivo Bensin,Automatic,60.000-65.000,Bensin,"Kediri Kota, Kediri Kota, Jawa Timur",2017,13
toyota yaris,188000000,toyota,Heykers,Automatic Triptonic,55.000-60.000,Hybrid,"Serpong Utara, Tangerang Selatan Kota, Banten",2017,12
toyota yaris,141800000,toyota,1.5 E Bensin,Manual,55.000-60.000,Bensin,"Pondok Aren, Tangerang Selatan Kota, Banten",2017,12
toyota yaris,188000000,toyota,1.5 TRD Sportivo Heykers Bensin,Manual,50.000-55.000,Bensin,"Pejaten Village Mall P-5, Jl. Warung Jati Barat, RT.1/RW.5, Jati Padang, Kecamatan Pasar Minggu, Jakarta Selatan, DKI JakartaDapatkan petunjuk",2017,11
toyota yaris,180000000,toyota,TRD Sportivo TRD M/T,Manual,50.000-55.000,Bensin,"Karawaci, Tangerang Kota, Banten",2017,11
toyota yaris,191000000,toyota,1.5 S Bensin,Automatic,45.000-50.000,Bensin,"Pesona Square Jl Ir.H.Juanda No 22A, Bakti Jaya, Kec Sukmajaya Depok, Jawa Barat 16422, Bakti Jaya, Kec.Sukmajaya, Depok, Jawa BaratDapatkan petunjuk",2017,10
toyota yaris,165000000,toyota,1.5 G Bensin,Manual,45.000-50.000,Bensin,"Tembalang, Semarang Kota, Jawa Tengah",2017,10
toyota yaris,202000000,toyota,1.5 TRD Sportivo Heykers Bensin,Automatic,40.000-45.000,Bensin,"Jl Cempaka Putih Tengah II No 16 Cempaka Putih, Cempaka Putih, Kecamatan Cempaka Putih, Jakarta Pusat, DKI JakartaDapatkan petunjuk",2017,9
toyota yaris,199000000,toyota,1.5 TRD Sportivo Bensin,Automatic Triptonic,40.000-45.000,Bensin,"Wonokromo, Surabaya Kota, Jawa Timur",2017,9
toyota yaris,205000000,toyota,1.5 TRD Sportivo Heykers Bensin,Automatic Triptonic,35.000-40.000,Bensin,"Tenggilis Mejoyo, Surabaya Kota, Jawa Timur",2017,8
toyota yaris,173000000,toyota,1.5 G Bensin,Automatic,35.000-40.000,Bensin,"Ciledug, Tangerang Kota, Banten",2017,8
toyota yaris,178800000,toyota,1.5 TRD Sportivo Bensin,Automatic,30.000-35.000,Bensin,"Menteng, Jakarta Pusat, Jakarta D.K.I.",2017,7
toyota yaris,163000000,toyota,1.5 G Bensin,Automatic Triptonic,30.000-35.000,Bensin,"Cimanggis, Depok Kota, Jawa Barat",2017,7
toyota yaris,210000000,toyota,1.5 TRD Sportivo Bensin,Automatic,25.000-30.000,Bensin,"Prajurit Kulon, Mojokerto Kota, Jawa Timur",2017,6
toyota yaris,175000000,toyota,1.5 G Bensin,Automatic,25.000-30.000,Bensin,"Cipocok Jaya, Serang Kota, Banten",2017,6
toyota yaris,210000000,toyota,1.5 TRD Sportivo Heykers Bensin,Automatic Triptonic,20.000-25.000,Bensin,"Magelang Tengah, Magelang Kota, Jawa Tengah",2017,5
toyota yaris,195000000,toyota,1.5 TRD Sportivo Heykers Bensin,Automatic,20.000-25.000,Bensin,"Tanjung Priok, Jakarta Utara, Jakarta D.K.I.",2017,5
toyota yaris,205000000,toyota,1.5 TRD Sportivo Bensin,Automatic Triptonic,15.000-20.000,Bensin,"Wiyung, Surabaya Kota, Jawa Timur",2017,4
toyota yaris,176000000,toyota,1.5 G Bensin,Automatic,90.000-95.000,Bensin,"Tambun Selatan, Bekasi Kab., Jawa Barat",2016,19
toyota yaris,185000000,toyota,1.5 TRD Sportivo Bensin,Manual,85.000-90.000,Bensin,"Bluluk, Lamongan  Kab., Jawa Timur",2016,18
toyota yaris,184999999,toyota,1.5 TRD Sportivo Bensin,Automatic,70.000-75.000,Bensin,"Gubeng, Surabaya Kota, Jawa Timur",2016,15
toyota yaris,183000000,toyota,1.5 TRD Sportivo Bensin,Automatic,70.000-75.000,Bensin,"Karawaci, Tangerang Kota, Banten",2016,15
toyota yaris,177000000,toyota,1.5 S Bensin,Automatic,70.000-75.000,Bensin,"Pejaten Village Mall P-5, Jl. Warung Jati Barat, RT.1/RW.5, Jati Padang, Kecamatan Pasar Minggu, Jakarta Selatan, DKI JakartaDapatkan petunjuk",2016,15
toyota yaris,172000000,toyota,1.5 TRD Sportivo Bensin,Automatic Triptonic,70.000-75.000,Bensin,"Batang, Batang Kab., Jawa Tengah",2016,15
toyota yaris,170000000,toyota,1.5 G Bensin,Automatic,70.000-75.000,Bensin,"Batu, Batu Kota, Jawa Timur",2016,15
toyota yaris,181000000,toyota,1.5 TRD Sportivo Bensin,Automatic,65.000-70.000,Bensin,"Sidoarjo, Sidoarjo  Kab., Jawa Timur",2016,14
toyota yaris,164000000,toyota,1.5 G Bensin,Automatic,65.000-70.000,Bensin,"Kelapa Dua, Tangerang Kab., Banten",2016,14
toyota yaris,195000000,toyota,1.5 TRD Sportivo Bensin,Automatic,55.000-60.000,Bensin,"Bekasi Barat, Bekasi Kota, Jawa Barat",2016,12
toyota yaris,168000000,toyota,1.5 G Bensin,Automatic,50.000-55.000,Bensin,"Sukun, Malang Kota, Jawa Timur",2016,11
toyota yaris,155000000,toyota,1.5 G Bensin,Manual,50.000-55.000,Bensin,"Jetis, Yogyakarta Kota, Yogyakarta D.I.",2016,11
toyota yaris,193000000,toyota,1.5 TRD Sportivo Bensin,Automatic,35.000-40.000,Bensin,"Babakan Ciparay, Bandung Kota, Jawa Barat",2016,8
toyota yaris,178000000,toyota,Heykers,Manual,35.000-40.000,Bensin,"Mertoyudan, Magelang Kab., Jawa Tengah",2016,8
toyota yaris,178000000,toyota,1.5 TRD Sportivo Bensin,Automatic,30.000-35.000,Bensin,"Pamulang, Tangerang Selatan Kota, Banten",2016,7
toyota yaris,156000000,toyota,1.5 G Bensin,Automatic,125.000-130.000,Bensin,"Dramaga, Bogor Kab., Jawa Barat",2016,26
toyota yaris,177000000,toyota,1.5 TRD Sportivo Bensin,Automatic,100.000-105.000,Bensin,"Purwakarta, Purwakarta Kab., Jawa Barat",2016,21
toyota yaris,170000000,toyota,1.5 TRD Sportivo Bensin,Automatic,95.000-100.000,Bensin,"Jl. Mohammad Ramdan no 25, Ancol, KEc. Regol, Kota Bandung, Cigereleng, Kecamatan Regol, Kota Bandung, Jawa BaratDapatkan petunjuk",2015,20
toyota yaris,160000000,toyota,1.5 G Bensin,Automatic,90.000-95.000,Bensin,"Karawaci, Tangerang Kota, Banten",2015,19
toyota yaris,169500000,toyota,1.5 Bensin,Automatic,80.000-85.000,Bensin,"Gubeng, Surabaya Kota, Jawa Timur",2015,17
toyota yaris,165000000,toyota,1.5 G Bensin,Automatic,80.000-85.000,Bensin,"Duren Sawit, Jakarta Timur, Jakarta D.K.I.",2015,17
toyota yaris,165500000,toyota,1.5 G Bensin,Automatic,70.000-75.000,Bensin,"Beji, Depok Kota, Jawa Barat",2015,15
toyota yaris,163000000,toyota,1.5 TRD Sportivo Bensin,Manual,70.000-75.000,Bensin,"Sukoharjo, Sukoharjo Kab., Jawa Tengah",2015,15
toyota yaris,146000000,toyota,1.5 G Bensin,Automatic,70.000-75.000,Bensin,"Cibinong, Bogor Kab., Jawa Barat",2015,15
toyota yaris,173000000,toyota,1.5 TRD Sportivo Bensin,Automatic,60.000-65.000,Bensin,"Blimbing, Malang Kota, Jawa Timur",2015,13
toyota yaris,168000000,toyota,1.5 TRD Sportivo Bensin,Automatic,60.000-65.000,Bensin,"Candimulyo, Magelang Kab., Jawa Tengah",2015,13
toyota yaris,180500000,toyota,1.5 TRD Sportivo Bensin,Automatic,55.000-60.000,Bensin,"Gubeng, Surabaya Kota, Jawa Timur",2015,12
toyota yaris,150000000,toyota,1.5 G Bensin,Manual,50.000-55.000,Bensin,"Jl Cempaka Putih Tengah II No 16 Cempaka Putih, Cempaka Putih, Kecamatan Cempaka Putih, Jakarta Pusat, DKI JakartaDapatkan petunjuk",2015,11
toyota yaris,142000000,toyota,1.5 G Bensin,Manual,50.000-55.000,Bensin,"Palmerah, Jakarta Barat, Jakarta D.K.I.",2015,11
toyota yaris,179000000,toyota,1.5 TRD Sportivo Bensin,Automatic,45.000-50.000,Bensin,"Pedurungan, Semarang Kota, Jawa Tengah",2015,10
toyota yaris,182000000,toyota,1.5 TRD Sportivo Bensin,Automatic,30.000-35.000,Bensin,"Cilodong, Depok Kota, Jawa Barat",2015,7
toyota yaris,166000000,toyota,1.5 TRD Sportivo Bensin,Automatic Triptonic,30.000-35.000,Bensin,"Cimanggis, Depok Kota, Jawa Barat",2015,7
toyota yaris,169500000,toyota,1.5 G Bensin,Automatic,20.000-25.000,Bensin,"Sidoarjo, Sidoarjo  Kab., Jawa Timur",2015,5
toyota yaris,175000000,toyota,1.5 TRD Sportivo Bensin,Automatic,120.000-125.000,Bensin,"Cakung, Jakarta Timur, Jakarta D.K.I.",2015,25
toyota yaris,176000000,toyota,1.5 TRD Sportivo Bensin,Automatic,105.000-110.000,Bensin,"Cibinong, Bogor Kab., Jawa Barat",2015,22
toyota rush,265000000,toyota,1.5 S GR Sport Bensin,Automatic,65.000-70.000,Bensin,"WTC Mangga Dua Lt 3A No 32, Mangga Dua, Mangga Dua, Jakarta Utara, DKI JakartaDapatkan petunjuk",2021,14
toyota rush,268000000,toyota,1.5 TRD Sportivo Bensin,Automatic,5.000-10.000,Bensin,"Pejaten Village Mall P-5, Jl. Warung Jati Barat, RT.1/RW.5, Jati Padang, Kecamatan Pasar Minggu, Jakarta Selatan, DKI JakartaDapatkan petunjuk",2021,2
toyota rush,260000000,toyota,1.5 TRD Sportivo Bensin,Automatic,5.000-10.000,Bensin,"Cilandak, Jakarta Selatan, Jakarta D.K.I.",2021,2
toyota rush,255000000,toyota,1.5 S GR Sport Bensin,Automatic,5.000-10.000,Bensin,"WTC Mangga Dua Lt 3A No 32, Mangga Dua, Mangga Dua, Jakarta Utara, DKI JakartaDapatkan petunjuk",2021,2
toyota rush,251000000,toyota,1.5 S GR Sport Bensin,Automatic,5.000-10.000,Bensin,"Cakung, Jakarta Timur, Jakarta D.K.I.",2021,2
toyota rush,248000000,toyota,1.5 TRD Sportivo Bensin,Automatic,5.000-10.000,Bensin,"Kotagede, Yogyakarta Kota, Yogyakarta D.I.",2021,2
toyota rush,246000000,toyota,1.5 S GR Sport Bensin,Automatic Triptonic,5.000-10.000,Bensin,"Pademangan, Jakarta Utara, Jakarta D.K.I.",2021,2
toyota rush,243000000,toyota,1.5 TRD Sportivo Bensin,Automatic,20.000-25.000,Bensin,"Jatinegara, Jakarta Timur, Jakarta D.K.I.",2021,5
toyota rush,255000000,toyota,1.5 TRD Sportivo Bensin,Manual,15.000-20.000,Bensin,"Blimbing, Malang Kota, Jawa Timur",2021,4
toyota rush,254500000,toyota,1.5 TRD Sportivo Bensin,Manual,15.000-20.000,Bensin,"Sukun, Malang Kota, Jawa Timur",2021,4
toyota rush,249500000,toyota,1.5 TRD Sportivo Bensin,Manual,15.000-20.000,Bensin,"Andir, Bandung Kota, Jawa Barat",2021,4
toyota rush,244999000,toyota,1.5 TRD Sportivo Bensin,Manual,15.000-20.000,Bensin,"Gubeng, Surabaya Kota, Jawa Timur",2021,4
toyota rush,259000000,toyota,1.5 TRD Sportivo Bensin,Automatic,10.000-15.000,Bensin,"Pademangan, Jakarta Utara, Jakarta D.K.I.",2021,3
toyota rush,252000000,toyota,1.5 TRD Sportivo 7 Bensin,Automatic,10.000-15.000,Bensin,"Karawaci, Tangerang Kota, Banten",2021,3
toyota rush,245000000,toyota,1.5 S GR Sport Bensin,Automatic,10.000-15.000,Bensin,"Cibodas, Tangerang Kota, Banten",2021,3
toyota rush,280000000,toyota,1.5 S GR Sport Bensin,Automatic,0-5.000,Bensin,"Gubeng, Surabaya Kota, Jawa Timur",2021,1
toyota rush,266500000,toyota,1.5 TRD Sportivo Bensin,Manual,0-5.000,Bensin,"Klojen, Malang Kota, Jawa Timur",2021,1
toyota rush,265000000,toyota,1.5 TRD Sportivo Bensin,Manual,0-5.000,Diesel,"Jl. Panji Suroso No.15/16, Polowijen, Kec. Blimbing, Kota Malang, Jawa Timur 65126, Polowijen, Kec. Blimbing, Kota Malang, Jawa TimurDapatkan petunjuk",2021,1
toyota rush,255000000,toyota,1.5 TRD Sportivo 7 Bensin,Manual,0-5.000,Bensin,"Wonokromo, Surabaya Kota, Jawa Timur",2021,1
toyota rush,250000000,toyota,1.5 TRD Sportivo Bensin,Manual,5.000-10.000,Bensin,"Telukjambe Timur, Karawang Kab., Jawa Barat",2020,2
toyota rush,245000000,toyota,1.5 TRD Sportivo Bensin,Manual,5.000-10.000,Bensin,"Mampang Prapatan, Jakarta Selatan, Jakarta D.K.I.",2020,2
toyota rush,237000000,toyota,1.5 TRD Sportivo 7 Bensin,Automatic,5.000-10.000,Bensin,"Duren Sawit, Jakarta Timur, Jakarta D.K.I.",2020,2
toyota rush,225000000,toyota,1.5 TRD Sportivo 7 Bensin,Automatic,45.000-50.000,Bensin,"Pulo Gadung, Jakarta Timur, Jakarta D.K.I.",2020,10
toyota rush,237000000,toyota,1.5 TRD Sportivo Bensin,Manual,35.000-40.000,Bensin,"Pangalengan, Bandung Kab., Jawa Barat",2020,8
toyota rush,263000000,toyota,1.5 TRD Sportivo Bensin,Automatic,30.000-35.000,Bensin,"Kebayoran Baru, Jakarta Selatan, Jakarta D.K.I.",2020,7
toyota rush,247000000,toyota,S TRD Sportivo Luxury,Manual,30.000-35.000,Bensin,"Gununganyar, Surabaya Kota, Jawa Timur",2020,7
toyota rush,238000000,toyota,1.5 TRD Sportivo Bensin,Automatic,30.000-35.000,Bensin,"Jetis, Yogyakarta Kota, Yogyakarta D.I.",2020,7
toyota rush,239300000,toyota,1.5 TRD Sportivo 7 Bensin,Automatic,25.000-30.000,Bensin,"Pademangan, Jakarta Utara, Jakarta D.K.I.",2020,6
toyota rush,225000000,toyota,1.5 TRD Sportivo Bensin,Automatic,20.000-25.000,Bensin,"Tanjung Priok, Jakarta Utara, Jakarta D.K.I.",2020,5
toyota rush,260000000,toyota,1.5 TRD Sportivo Bensin,Automatic,15.000-20.000,Bensin,"Blimbing, Malang Kota, Jawa Timur",2020,4
toyota rush,248999999,toyota,S TRD Sportivo Luxury,Automatic,15.000-20.000,Bensin,"Pulo Gadung, Jakarta Timur, Jakarta D.K.I.",2020,4
toyota rush,246000000,toyota,1.5 S Bensin,Manual,15.000-20.000,Bensin,"Setia Budi, Jakarta Selatan, Jakarta D.K.I.",2020,4
toyota rush,245000000,toyota,S TRD Sportivo Luxury,Automatic,10.000-15.000,Bensin,"Kelapa Dua, Tangerang Kab., Banten",2020,3
toyota rush,227500000,toyota,1.5 G Bensin,Automatic,10.000-15.000,Bensin,"Kebayoran Baru, Jakarta Selatan, Jakarta D.K.I.",2020,3
toyota rush,235000000,toyota,1.5 G Bensin,Manual,0-5.000,Bensin,"Cicendo, Bandung Kota, Jawa Barat",2020,1
toyota rush,230000000,toyota,1.5 TRD Sportivo Bensin,Automatic,0-5.000,Bensin,"Pondok Aren, Tangerang Selatan Kota, Banten",2020,1
toyota rush,230000000,toyota,1.5 TRD Sportivo Bensin,Automatic,70.000-75.000,Bensin,"Bekasi Selatan, Bekasi Kota, Jawa Barat",2019,15
toyota rush,250000000,toyota,1.5 G Bensin,Automatic,65.000-70.000,Bensin,"Harjamukti, Cirebon Kota, Jawa Barat",2019,14
toyota rush,239000000,toyota,1.5 TRD Sportivo Bensin,Automatic,65.000-70.000,Bensin,"Carsworld Building, Lengkong Gudang, Serpong, Kecamatan Serpong, BSD, BantenDapatkan petunjuk",2019,14
toyota rush,231000000,toyota,1.5 TRD Sportivo 7 Bensin,Automatic,65.000-70.000,Bensin,"Pesona Square Jl Ir.H.Juanda No 22A, Bakti Jaya, Kec Sukmajaya Depok, Jawa Barat 16422, Bakti Jaya, Kec.Sukmajaya, Depok, Jawa BaratDapatkan petunjuk",2019,14
toyota rush,232000000,toyota,1.5 TRD Sportivo Bensin,Automatic,50.000-55.000,Bensin,"Mall Tamini Square Basement Zona D, Jl. Taman Mini I No.1, RW.2, Pinang Ranti, Kec. Makasar, Kota Jakarta Timur, Daerah Khusus Ibukota Jakarta 13560, Pinang Ranti, Makasar, Jakarta Timur, DKI JakartaDapatkan petunjuk",2019,11
toyota rush,198000000,toyota,1.5 G Bensin,Automatic,50.000-55.000,Bensin,"Cilandak, Jakarta Selatan, Jakarta D.K.I.",2019,11
toyota rush,258000000,toyota,1.5 TRD Sportivo 7 Bensin,Manual,5.000-10.000,Bensin,"Mlati, Sleman Kab., Yogyakarta D.I.",2019,2
toyota rush,237000000,toyota,1.5 TRD Sportivo Bensin,Automatic,5.000-10.000,Bensin,"Mall Tamini Square Basement Zona D, Jl. Taman Mini I No.1, RW.2, Pinang Ranti, Kec. Makasar, Kota Jakarta Timur, Daerah Khusus Ibukota Jakarta 13560, Pinang Ranti, Makasar, Jakarta Timur, DKI JakartaDapatkan petunjuk",2019,2
toyota rush,239999999,toyota,1.5 TRD Sportivo Bensin,Automatic,40.000-45.000,Bensin,"Tenggilis Mejoyo, Surabaya Kota, Jawa Timur",2019,9
toyota rush,236000000,toyota,1.5 TRD Sportivo Bensin,Automatic,40.000-45.000,Bensin,"Cengkareng, Jakarta Barat, Jakarta D.K.I.",2019,9
toyota rush,246000000,toyota,1.5 TRD Sportivo 7 Bensin,Automatic,35.000-40.000,Bensin,"Imogiri, Bantul Kab., Yogyakarta D.I.",2019,8
toyota rush,235000000,toyota,1.5 S Bensin,Automatic,35.000-40.000,Bensin,"Pademangan, Jakarta Utara, Jakarta D.K.I.",2019,8
toyota rush,239000000,toyota,1.5 TRD Sportivo 7 Bensin,Automatic,30.000-35.000,Bensin,"Regol, Bandung Kota, Jawa Barat",2019,7
toyota rush,229000000,toyota,1.5 TRD Sportivo Bensin,Automatic,30.000-35.000,Bensin,"Kelapa Gading, Jakarta Utara, Jakarta D.K.I.",2019,7
toyota rush,210000000,toyota,1.5 TRD Sportivo Bensin,Automatic,30.000-35.000,Bensin,"Kelapa Dua, Tangerang Kab., Banten",2019,7
toyota rush,210000000,toyota,1.5 G Bensin,Automatic,25.000-30.000,Bensin,"Tangerang, Tangerang Kota, Banten",2019,6
toyota rush,248000000,toyota,1.5 TRD Sportivo Bensin,Automatic,20.000-25.000,Bensin,"Regol, Bandung Kota, Jawa Barat",2019,5
toyota rush,225000000,toyota,1.5 TRD Sportivo Bensin,Automatic,20.000-25.000,Bensin,"Kemayoran, Jakarta Pusat, Jakarta D.K.I.",2019,5
toyota rush,225000000,toyota,1.5 TRD Sportivo 7 Bensin,Automatic,20.000-25.000,Bensin,"Pademangan, Jakarta Utara, Jakarta D.K.I.",2019,5
toyota rush,219000000,toyota,1.5 TRD Sportivo Bensin,Automatic Triptonic,20.000-25.000,Bensin,"Bella Terra Lifestyle, Jl. Boulevard Raya No.kav 1, Klp. Gading Tim., 14240, Kelapa Gading, Kecamatan Kelapa Gading, Jakarta Utara, DKI JakartaDapatkan petunjuk",2019,5
toyota rush,248500000,toyota,S TRD Sportivo Luxury,Automatic,15.000-20.000,Bensin,"Mojoroto, Kediri Kota, Jawa Timur",2019,4
toyota rush,235000000,toyota,1.5 TRD Sportivo 7 Bensin,Manual,15.000-20.000,Bensin,"Jagakarsa, Jakarta Selatan, Jakarta D.K.I.",2019,4
toyota rush,217000000,toyota,1.5 G Bensin,Automatic Triptonic,15.000-20.000,Bensin,"Pasar Minggu, Jakarta Selatan, Jakarta D.K.I.",2019,4
toyota rush,235000000,toyota,1.5 TRD Sportivo Bensin,Automatic,100.000-105.000,Bensin,"Serang, Serang Kota, Banten",2019,21
toyota rush,232400000,toyota,1.5 TRD Sportivo Bensin,Automatic,10.000-15.000,Bensin,"Ciputat, Tangerang Selatan Kota, Banten",2019,3
toyota rush,209000000,toyota,1.5 TRD Sportivo Bensin,Automatic,95.000-100.000,Bensin,"Bursa Mobil Bintaro, Jl. Boulevard B7/B1, Bintaro Jaya Sektor 7, blok A19 dan A25, Pd. Jaya, Kecamatan Pd. Aren, Kecamatan Pondok Aren, Tanggerang Selatan, BantenDapatkan petunjuk",2018,20
toyota rush,212000000,toyota,1.5 TRD Sportivo Bensin,Automatic,85.000-90.000,Bensin,"Duren Sawit, Jakarta Timur, Jakarta D.K.I.",2018,18
toyota rush,148000000,toyota,1.5 G Bensin,Automatic,80.000-85.000,Bensin,"Jl. Ibrahim Adjie No.377, Binong, Kec. Kiaracondong, Kota Bandung, Jawa Barat 40275, Binong, Kecamatan Kiaracondong, Kota Bandung, Jawa BaratDapatkan petunjuk",2018,17
toyota rush,212000000,toyota,1.5 G Bensin,Automatic,70.000-75.000,Bensin,"Kediri Kota, Kediri Kota, Jawa Timur",2018,15
toyota rush,242000000,toyota,1.5 TRD Sportivo Bensin,Automatic,60.000-65.000,Bensin,"Tambun Selatan, Bekasi Kab., Jawa Barat",2018,13
toyota rush,219000000,toyota,1.5 TRD Sportivo 7 Bensin,Automatic,50.000-55.000,Bensin,"Kebon Jeruk, Jakarta Barat, Jakarta D.K.I.",2018,11
toyota rush,215000000,toyota,1.5 TRD Sportivo Bensin,Automatic,50.000-55.000,Bensin,"Jatinegara, Jakarta Timur, Jakarta D.K.I.",2018,11
toyota rush,210000000,toyota,1.5 G Bensin,Automatic,50.000-55.000,Bensin,"Jatinegara, Jakarta Timur, Jakarta D.K.I.",2018,11
toyota rush,224500000,toyota,1.5 S GR Sport Bensin,Manual,5.000-10.000,Bensin,"Ciracas, Jakarta Timur, Jakarta D.K.I.",2018,2
