title,price,brand,type,transmission,milage,fuel,location,years,milage_class
toyota avanza,147000000,toyota,1.3 G Bensin,Automatic,90.000-95.000,Bensin,"Wonokromo, Surabaya Kota, Jawa Timur",2016,19
toyota avanza,138000000,toyota,1.3 E Bensin,Manual,85.000-90.000,Bensin,"Mayong, Jepara Kab., Jawa Tengah",2016,18
toyota avanza,168000000,toyota,1.5 Veloz Bensin,Manual,80.000-85.000,Bensin,"Jl. Kupang Jaya No.110, Sukomanunggal, Kec. Sukomanunggal, Kota SBY, Jawa Timur 60281, Kupang Jaya, Kec. Sukomanunggal, Kota Surabaya, Jawa TimurDapatkan petunjuk",2016,17
toyota avanza,167500000,toyota,1.5 Veloz Bensin,Manual,80.000-85.000,Bensin,"Sukun, Malang Kota, Jawa Timur",2016,17
toyota avanza,148500000,toyota,1.3 G Bensin,Manual,80.000-85.000,Bensin,"Astana Anyar, Bandung Kota, Jawa Barat",2016,17
toyota avanza,170000000,toyota,Lain-lain,Manual,75.000-80.000,Bensin,"Batu, Batu Kota, Jawa Timur",2016,16
toyota avanza,148000000,toyota,1.3 G Bensin,Manual,75.000-80.000,Bensin,"Kelapa Dua, Tangerang Kab., Banten",2016,16
toyota avanza,153000000,toyota,1.3 G Bensin,Manual,70.000-75.000,Bensin,"Blimbing, Malang Kota, Jawa Timur",2016,15
toyota avanza,142000000,toyota,1.3 G Bensin,Manual,70.000-75.000,Bensin,"Mustika Jaya, Bekasi Kota, Jawa Barat",2016,15
toyota avanza,159000000,toyota,1.3 Veloz Bensin,Manual,65.000-70.000,Bensin,"Karawang Barat, Karawang Kab., Jawa Barat",2016,14
toyota avanza,146000000,toyota,1.3 G Bensin,Automatic,60.000-65.000,Bensin,"Tambun Selatan, Bekasi Kab., Jawa Barat",2016,13
toyota avanza,159000000,toyota,1.3 G Bensin,Manual,55.000-60.000,Bensin,"Blimbing, Malang Kota, Jawa Timur",2016,12
toyota avanza,157000000,toyota,1.3 Veloz Bensin,Automatic,50.000-55.000,Bensin,"Kebon Jeruk, Jakarta Barat, Jakarta D.K.I.",2016,11
toyota avanza,160000000,toyota,1.3 G Bensin,Manual,45.000-50.000,Bensin,"Jl. Jend. Sudirman No.573, Sukahaji, Kec. Babakan Ciparay, Kota Bandung, Jawa Barat 40221, Sukahaji, Kecamatan Babakan ciparay, Bandung, Jawa BaratDapatkan petunjuk",2016,10
toyota avanza,140000000,toyota,1.3 G Bensin,Automatic,45.000-50.000,Bensin,"Tenggilis Mejoyo, Surabaya Kota, Jawa Timur",2016,10
toyota avanza,155000000,toyota,1.3 G Bensin,Manual,30.000-35.000,Bensin,"Sukolilo, Surabaya Kota, Jawa Timur",2016,7
toyota avanza,137500000,toyota,1.5 Veloz Bensin,Manual,140.000-145.000,Bensin,"Jl. Tole Iskandar No 10. Kel. Sukamaju Kecamatan Cilodong Depok, Sukamaju, Kecamatan Cilodong, Kota Depok, Jawa BaratDapatkan petunjuk",2016,29
toyota avanza,154000000,toyota,1.3 G Bensin,Manual,125.000-130.000,Bensin,"Gunung Putri, Bogor Kab., Jawa Barat",2016,26
toyota avanza,135000000,toyota,1.3 G Bensin,Manual,120.000-125.000,Bensin,"Pancoran, Jakarta Selatan, Jakarta D.K.I.",2016,25
toyota avanza,132000000,toyota,1.3 G Bensin,Manual,120.000-125.000,Bensin,"Duren Sawit, Jakarta Timur, Jakarta D.K.I.",2016,25
toyota avanza,149000000,toyota,1.3 G Bensin,Manual,110.000-115.000,Bensin,"Jl. Inspeksi Tarum Bar. No.33, RT.3/RW.10, Cipinang Melayu, Kecamatan Makasar, Jakarta Timur, DKI JakartaDapatkan petunjuk",2016,23
toyota avanza,147500000,toyota,1.3 G Bensin,Manual,100.000-105.000,Bensin,"Semarang Selatan, Semarang Kota, Jawa Tengah",2016,21
toyota avanza,136000000,toyota,1.3 G Bensin,Manual,100.000-105.000,Bensin,"Pondok Gede, Bekasi Kota, Jawa Barat",2016,21
toyota avanza,120000000,toyota,1.3 E Bensin,Manual,100.000-105.000,Bensin,"Duren Sawit, Jakarta Timur, Jakarta D.K.I.",2016,21
toyota avanza,115000000,toyota,1.3 E Bensin,Manual,95.000-100.000,Bensin,"Jl. Jendral Ahmad Yani No.819, Padasuka, Kec. Kiaracondong, Kota Bandung, Jawa Barat 40125, Padasuka, Kecamatan Kiaracondong, Kota Bandung, Jawa BaratDapatkan petunjuk",2015,20
toyota avanza,165000000,toyota,1.5 Veloz Bensin,Automatic,90.000-95.000,Bensin,"Serpong, Tangerang Selatan Kota, Banten",2015,19
toyota avanza,149000000,toyota,1.3 Veloz Bensin,Manual,90.000-95.000,Bensin,"Kalasan, Sleman Kab., Yogyakarta D.I.",2015,19
toyota avanza,127000000,toyota,1.3 G Bensin,Manual,85.000-90.000,Bensin,"Kelapa Dua, Tangerang Kab., Banten",2015,18
toyota avanza,146900000,toyota,1.3 G Bensin,Manual,75.000-80.000,Bensin,"Regol, Bandung Kota, Jawa Barat",2015,16
toyota avanza,130000000,toyota,1.3 G Bensin,Manual,70.000-75.000,Bensin,"Kelapa Dua, Tangerang Kab., Banten",2015,15
toyota avanza,149000000,toyota,1.5 Luxury Veloz Bensin,Manual,60.000-65.000,Bensin,"Jatinegara, Jakarta Timur, Jakarta D.K.I.",2015,13
toyota avanza,132000000,toyota,1.3 G Bensin,Manual,45.000-50.000,Bensin,"Makasar, Jakarta Timur, Jakarta D.K.I.",2015,10
toyota avanza,145000000,toyota,1.3 G Bensin,Manual,40.000-45.000,Bensin,"Mustika Jaya, Bekasi Kota, Jawa Barat",2015,9
toyota avanza,147000000,toyota,1.3 G Bensin,Manual,35.000-40.000,Bensin,"Tambun Selatan, Bekasi Kab., Jawa Barat",2015,8
toyota avanza,157000000,toyota,1.3 Veloz Bensin,Manual,20.000-25.000,Bensin,"Duren Sawit, Jakarta Timur, Jakarta D.K.I.",2015,5
toyota avanza,125000000,toyota,1.3 G Bensin,Manual,170.000-175.000,Bensin,"Mall Tamini Square Basement Zona D, Jl. Taman Mini I No.1, RW.2, Pinang Ranti, Kec. Makasar, Kota Jakarta Timur, Daerah Khusus Ibukota Jakarta 13560, Pinang Ranti, Makasar, Jakarta Timur, DKI JakartaDapatkan petunjuk",2015,35
toyota avanza,139000000,toyota,1.3 G Bensin,Manual,150.000-155.000,Bensin,"Laweyan, Surakarta Kota, Jawa Tengah",2015,31
toyota avanza,118000000,toyota,1.3 G Bensin,Manual,150.000-155.000,Bensin,"Cikarang Pusat, Bekasi Kab., Jawa Barat",2015,31
toyota avanza,138500000,toyota,1.3 G Bensin,Automatic,140.000-145.000,Bensin,"Blimbing, Malang Kota, Jawa Timur",2015,29
toyota avanza,143000000,toyota,1.5 New Veloz Bensin,Automatic,110.000-115.000,Bensin,"Jl. Kupang Jaya No.110, Sukomanunggal, Kec. Sukomanunggal, Kota SBY, Jawa Timur 60281, Kupang Jaya, Kec. Sukomanunggal, Kota Surabaya, Jawa TimurDapatkan petunjuk",2015,23
toyota avanza,120500000,toyota,1.3 E Bensin,Manual,105.000-110.000,Bensin,"Tarogong Kidul, Garut Kab., Jawa Barat",2015,22
toyota avanza,119000000,toyota,1.3 G Bensin,Manual,105.000-110.000,Bensin,"Citeureup, Bogor Kab., Jawa Barat",2015,22
mitsubishi xpander,265000000,mitsubishi,1.5 Ultimate Bensin,Automatic,0-5.000,Bensin,"Kediri Kota, Kediri Kota, Jawa Timur",2019,1
honda jazz,195000000,honda,1.5 S Bensin,Automatic,20.000-25.000,Bensin,"Gubeng, Surabaya Kota, Jawa Timur",2017,5
honda jazz,199999999,honda,1.5 RS Bensin,Manual,35.000-40.000,Bensin,"Mulyorejo, Surabaya Kota, Jawa Timur",2016,8
toyota avanza,190000000,toyota,1.5 New Veloz Bensin,Manual,15.000-20.000,Bensin,"Gubeng, Surabaya Kota, Jawa Timur",2019,4
mitsubishi xpander,280000000,mitsubishi,1.5 Cross Premium Package Bensin,Automatic,5.000-10.000,Bensin,"Blimbing, Malang Kota, Jawa Timur",2021,2
mitsubishi xpander,275000000,mitsubishi,1.5 Bensin,Automatic,5.000-10.000,Bensin,"Tangerang, Tangerang Kota, Banten",2021,2
mitsubishi xpander,270000000,mitsubishi,1.5 Cross Premium Package Bensin,Automatic,5.000-10.000,Bensin,"Genteng, Banyuwangi  Kab., Jawa Timur",2021,2
mitsubishi xpander,267000000,mitsubishi,1.5 Cross Bensin,Automatic,5.000-10.000,Bensin,"Sambung Macan, Sragen Kab., Jawa Tengah",2021,2
mitsubishi xpander,262500000,mitsubishi,1.5 Sport Bensin,Manual,5.000-10.000,Bensin,"Kediri Kota, Kediri Kota, Jawa Timur",2021,2
mitsubishi xpander,229500000,mitsubishi,1.5 Sport Bensin,Manual,5.000-10.000,Bensin,"Jatinegara, Jakarta Timur, Jakarta D.K.I.",2021,2
mitsubishi xpander,130000000,mitsubishi,1.5 Cross Premium Package Bensin,Automatic,5.000-10.000,Bensin,"Lowokwaru, Malang Kota, Jawa Timur",2021,2
mitsubishi xpander,255000000,mitsubishi,ULTIMATE A/T,Automatic,30.000-35.000,Bensin,"Banguntapan, Bantul Kab., Yogyakarta D.I.",2021,7
mitsubishi xpander,225000000,mitsubishi,1.5 GLS Bensin,Automatic,20.000-25.000,Bensin,"Kelapa Gading, Jakarta Utara, Jakarta D.K.I.",2021,5
mitsubishi xpander,272000000,mitsubishi,1.5 Cross Bensin,Automatic,15.000-20.000,Bensin,"Tenggilis Mejoyo, Surabaya Kota, Jawa Timur",2021,4
mitsubishi xpander,265000000,mitsubishi,1.5 Cross Bensin,Automatic,15.000-20.000,Bensin,"Pademangan, Jakarta Utara, Jakarta D.K.I.",2021,4
mitsubishi xpander,240000000,mitsubishi,ULTIMATE A/T,Automatic,15.000-20.000,Bensin,"Cibodas, Tangerang Kota, Banten",2021,4
mitsubishi xpander,285000000,mitsubishi,1.5 Cross Bensin,Automatic,10.000-15.000,Bensin,"Margaasih, Bandung Kab., Jawa Barat",2021,3
mitsubishi xpander,270000000,mitsubishi,1.5 Cross Bensin,Manual,10.000-15.000,Bensin,"Gubeng, Surabaya Kota, Jawa Timur",2021,3
mitsubishi xpander,265000000,mitsubishi,1.5 Limited Bensin,Automatic,10.000-15.000,Bensin,"Kemayoran, Jakarta Pusat, Jakarta D.K.I.",2021,3
mitsubishi xpander,255000000,mitsubishi,1.5 Ultimate Bensin,Automatic Triptonic,10.000-15.000,Bensin,"Mega Glodok Kemayoran (MGK) lantai 2 Blok S-50, Kemayoran, Kemayoran, Jakarta Utara, DKI JakartaDapatkan petunjuk",2021,3
mitsubishi xpander,249000000,mitsubishi,1.5 Sport Bensin,Automatic,10.000-15.000,Bensin,"Tanah Abang, Jakarta Pusat, Jakarta D.K.I.",2021,3
mitsubishi xpander,279000000,mitsubishi,1.5 Cross Premium Package Bensin,Automatic,0-5.000,Bensin,"Wonocolo, Surabaya Kota, Jawa Timur",2021,1
mitsubishi xpander,275000000,mitsubishi,ULTIMATE A/T,Automatic,0-5.000,Bensin,"Rungkut, Surabaya Kota, Jawa Timur",2021,1
mitsubishi xpander,269000000,mitsubishi,1.5 Sport Bensin,Automatic,0-5.000,Bensin,"Purwokerto Utara, Banyumas Kab., Jawa Tengah",2021,1
mitsubishi xpander,249000000,mitsubishi,1.5 Exceed Bensin,Manual,0-5.000,Bensin,"Purwokerto Barat, Banyumas Kab., Jawa Tengah",2021,1
mitsubishi xpander,248500000,mitsubishi,1.5 Ultimate Bensin,Automatic,0-5.000,Bensin,"Menteng, Jakarta Pusat, Jakarta D.K.I.",2021,1
mitsubishi xpander,212000000,mitsubishi,1.5 Exceed Bensin,Manual,50.000-55.000,Bensin,"Gubeng, Surabaya Kota, Jawa Timur",2020,11
mitsubishi xpander,250000000,mitsubishi,EXCEED A/T,Automatic,45.000-50.000,Bensin,"Gubeng, Surabaya Kota, Jawa Timur",2020,10
mitsubishi xpander,245000000,mitsubishi,1.5 Ultimate Bensin,Automatic Triptonic,45.000-50.000,Bensin,"Semarang Tengah, Semarang Kota, Jawa Tengah",2020,10
mitsubishi xpander,225000000,mitsubishi,ULTIMATE A/T,Automatic,40.000-45.000,Bensin,"Pademangan, Jakarta Utara, Jakarta D.K.I.",2020,9
mitsubishi xpander,270000000,mitsubishi,1.5 Cross Premium Package Bensin,Automatic,35.000-40.000,Bensin,"Jl. tentara Pelajar no.73,Pekiringan,Kesambi, Kota Cirebon, Kesambi, Kesambi, Kota Cirebon, Jawa BaratDapatkan petunjuk",2020,8
mitsubishi xpander,225000000,mitsubishi,1.5 Ultimate Bensin,Automatic,35.000-40.000,Bensin,"Cempaka Putih, Jakarta Pusat, Jakarta D.K.I.",2020,8
mitsubishi xpander,254000000,mitsubishi,1.5 Cross Premium Package Bensin,Automatic,20.000-25.000,Bensin,"Kosambi, Tangerang Kab., Banten",2020,5
mitsubishi xpander,280000000,mitsubishi,1.5 Ultimate Bensin,Automatic,15.000-20.000,Bensin,"Gedangan, Sidoarjo  Kab., Jawa Timur",2020,4
mitsubishi xpander,279000000,mitsubishi,1.5 Cross Bensin,Automatic,15.000-20.000,Bensin,"Jl. Terusan Buah Batu No.41, Batununggal, Kec. Bandung Kidul, Kota Bandung, Jawa Barat 40266, Buah Batu, Bandung Kidul, Bandung, Jawa BaratDapatkan petunjuk",2020,4
mitsubishi xpander,255000000,mitsubishi,1.5 Sport Bensin,Automatic,15.000-20.000,Bensin,"Bubutan, Surabaya Kota, Jawa Timur",2020,4
mitsubishi xpander,266000000,mitsubishi,1.5 Cross Premium Package Bensin,Automatic,10.000-15.000,Bensin,"Serpong, Tangerang Selatan Kota, Banten",2020,3
mitsubishi xpander,265000000,mitsubishi,1.5 Cross Premium Package Bensin,Automatic,10.000-15.000,Bensin,"Lowokwaru, Malang Kota, Jawa Timur",2020,3
mitsubishi xpander,264999000,mitsubishi,1.5 Cross Bensin,Automatic,10.000-15.000,Bensin,"Gubeng, Surabaya Kota, Jawa Timur",2020,3
mitsubishi xpander,255000000,mitsubishi,1.5 Cross Premium Package Bensin,Automatic Triptonic,10.000-15.000,Bensin,"Pancoran Mas, Depok Kota, Jawa Barat",2020,3
mitsubishi xpander,265000000,mitsubishi,1.5 Ultimate Bensin,Automatic,0-5.000,Bensin,"Kediri Kota, Kediri Kota, Jawa Timur",2020,1
mitsubishi xpander,234000000,mitsubishi,1.5 Limited Bensin,Automatic,70.000-75.000,Bensin,"Jl Raya tajur no 153 Bogor, Jl Raya Tajur No 240 Wangun Bogor,, Bogor Selatan, Bogor Selatan, Kota Bogor, Jawa BaratDapatkan petunjuk",2019,15
mitsubishi xpander,229000000,mitsubishi,ULTIMATE A/T,Automatic,65.000-70.000,Bensin,"Grogol, Sukoharjo Kab., Jawa Tengah",2019,14
mitsubishi xpander,212000000,mitsubishi,1.5 Exceed Bensin,Automatic,65.000-70.000,Bensin,"Kediri Kota, Kediri Kota, Jawa Timur",2019,14
mitsubishi xpander,239500000,mitsubishi,1.5 Ultimate Bensin,Automatic,60.000-65.000,Bensin,"Kedungkandang, Malang Kota, Jawa Timur",2019,13
mitsubishi xpander,249000000,mitsubishi,1.5 Cross Premium Package Bensin,Automatic,55.000-60.000,Bensin,"Kudus Kota, Kudus Kab., Jawa Tengah",2019,12
mitsubishi xpander,225000000,mitsubishi,1.5 Ultimate Bensin,Automatic,55.000-60.000,Bensin,"Jl. Cempaka Putih Tengah II No.16, RT.: 01/RW.: 05, Cempaka Putih Timur, Kecamatan Cempaka Putih, Jakarta Pusat, DKI JakartaDapatkan petunjuk",2019,12
mitsubishi xpander,215000000,mitsubishi,1.5 Ultimate Bensin,Automatic,50.000-55.000,Bensin,"Kelapa Dua, Tangerang Kab., Banten",2019,11
mitsubishi xpander,194000000,mitsubishi,1.5 GLS Bensin,Automatic,50.000-55.000,Bensin,"Kembangan, Jakarta Barat, Jakarta D.K.I.",2019,11
mitsubishi xpander,257500000,mitsubishi,1.5 Limited Bensin,Automatic,5.000-10.000,Bensin,"Tenggilis Mejoyo, Surabaya Kota, Jawa Timur",2019,2
mitsubishi xpander,245000000,mitsubishi,1.5 Ultimate Bensin,Automatic,5.000-10.000,Bensin,"Gubeng, Surabaya Kota, Jawa Timur",2019,2
mitsubishi xpander,235000000,mitsubishi,ULTIMATE A/T,Automatic,45.000-50.000,Bensin,"Pademangan, Jakarta Utara, Jakarta D.K.I.",2019,10
mitsubishi xpander,220000000,mitsubishi,ULTIMATE A/T,Automatic,45.000-50.000,Bensin,"Cilandak, Jakarta Selatan, Jakarta D.K.I.",2019,10
mitsubishi xpander,211000000,mitsubishi,1.5 Sport Bensin,Manual,45.000-50.000,Bensin,"Wonokromo, Surabaya Kota, Jawa Timur",2019,10
mitsubishi xpander,231000000,mitsubishi,1.5 Ultimate Bensin,Automatic,40.000-45.000,Bensin,"Cakung, Jakarta Timur, Jakarta D.K.I.",2019,9
mitsubishi xpander,215000000,mitsubishi,ULTIMATE A/T,Automatic,40.000-45.000,Bensin,"Duren Sawit, Jakarta Timur, Jakarta D.K.I.",2019,9
mitsubishi xpander,208000000,mitsubishi,Lain-lain,Automatic,40.000-45.000,Bensin,"Tanah Abang, Jakarta Pusat, Jakarta D.K.I.",2019,9
mitsubishi xpander,197000000,mitsubishi,1.5 Ultimate Bensin,Automatic,40.000-45.000,Bensin,"Cilegon, Cilegon Kota, Banten",2019,9
mitsubishi xpander,242000000,mitsubishi,1.5 Ultimate Bensin,Automatic,35.000-40.000,Bensin,"Jl. Jendral Sudirman no 573, Sukahaji, Kecamatan Babakan ciparay, Bandung, Jawa BaratDapatkan petunjuk",2019,8
mitsubishi xpander,238000000,mitsubishi,1.5 Ultimate Bensin,Automatic,35.000-40.000,Bensin,"Gubeng, Surabaya Kota, Jawa Timur",2019,8
mitsubishi xpander,235000000,mitsubishi,1.5 Ultime Bensin,Automatic Triptonic,35.000-40.000,Bensin,"Wiyung, Surabaya Kota, Jawa Timur",2019,8
mitsubishi xpander,226000000,mitsubishi,1.5 Ultimate Bensin,Automatic,35.000-40.000,Bensin,"Pejaten Village Mall P-5, Jl. Warung Jati Barat, RT.1/RW.5, Jati Padang, Kecamatan Pasar Minggu, Jakarta Selatan, DKI JakartaDapatkan petunjuk",2019,8
mitsubishi xpander,217000000,mitsubishi,1.5 Sport Bensin,Automatic Triptonic,35.000-40.000,Bensin,"Pancoran Mas, Depok Kota, Jawa Barat",2019,8
mitsubishi xpander,215000000,mitsubishi,1.5 Sport Bensin,Automatic,35.000-40.000,Bensin,"Jonggol, Bogor Kab., Jawa Barat",2019,8
mitsubishi xpander,209999000,mitsubishi,1.5 Exceed Bensin,Automatic,35.000-40.000,Bensin,"Gubeng, Surabaya Kota, Jawa Timur",2019,8
mitsubishi xpander,245000000,mitsubishi,1.5 Limited Bensin,Automatic,30.000-35.000,Bensin,"Pesanggrahan, Jakarta Selatan, Jakarta D.K.I.",2019,7
mitsubishi xpander,242500000,mitsubishi,1.5 Ultimate Bensin,Automatic,30.000-35.000,Bensin,"Jl. Panji Suroso No.15/16, Polowijen, Kec. Blimbing, Kota Malang, Jawa Timur 65126, Polowijen, Kec. Blimbing, Kota Malang, Jawa TimurDapatkan petunjuk",2019,7
mitsubishi xpander,242000000,mitsubishi,ULTIMATE A/T,Automatic,30.000-35.000,Bensin,"Serpong, Tangerang Selatan Kota, Banten",2019,7
mitsubishi xpander,238500000,mitsubishi,1.5 Ultimate Bensin,Automatic,30.000-35.000,Bensin,"Klojen, Malang Kota, Jawa Timur",2019,7
mitsubishi xpander,232000000,mitsubishi,1.5 Ultimate Bensin,Automatic,30.000-35.000,Bensin,"Lamongan, Lamongan  Kab., Jawa Timur",2019,7
mitsubishi xpander,229000000,mitsubishi,SPORT A/T,Automatic,30.000-35.000,Bensin,"Lengkong, Bandung Kota, Jawa Barat",2019,7
mitsubishi xpander,225000000,mitsubishi,ULTIMATE A/T,Automatic,30.000-35.000,Bensin,"Kelapa Dua, Tangerang Kab., Banten",2019,7
mitsubishi xpander,210000000,mitsubishi,EXCEED A/T,Automatic,30.000-35.000,Bensin,"Sidoarjo, Sidoarjo  Kab., Jawa Timur",2019,7
mitsubishi xpander,200000000,mitsubishi,EXCEED A/T,Automatic,30.000-35.000,Bensin,"Cakung, Jakarta Timur, Jakarta D.K.I.",2019,7
mitsubishi xpander,235000000,mitsubishi,1.5 Ultimate Bensin,Automatic,25.000-30.000,Bensin,"Pesanggrahan, Jakarta Selatan, Jakarta D.K.I.",2019,6
mitsubishi xpander,230000000,mitsubishi,1.5 Ultimate Bensin,Automatic Triptonic,25.000-30.000,Bensin,"Kelapa Gading, Jakarta Utara, Jakarta D.K.I.",2019,6
mitsubishi xpander,210000000,mitsubishi,SPORT A/T,Automatic,25.000-30.000,Bensin,"Tangerang, Tangerang Kota, Banten",2019,6
mitsubishi xpander,266000000,mitsubishi,1.5 Cross Bensin,Automatic,20.000-25.000,Bensin,"Cimahi Selatan, Cimahi Kota, Jawa Barat",2019,5
mitsubishi xpander,240000000,mitsubishi,1.5 Ultimate Bensin,Automatic Triptonic,20.000-25.000,Bensin,"Klojen, Malang Kota, Jawa Timur",2019,5
mitsubishi xpander,238000000,mitsubishi,SPORT A/T,Automatic,20.000-25.000,Bensin,"Gubeng, Surabaya Kota, Jawa Timur",2019,5
mitsubishi xpander,215000000,mitsubishi,SPORT A/T,Automatic,20.000-25.000,Bensin,"Banguntapan, Bantul Kab., Yogyakarta D.I.",2019,5
mitsubishi xpander,260000999,mitsubishi,1.5 Cross Premium Package Bensin,Automatic,15.000-20.000,Bensin,"Grogol Petamburan, Jakarta Barat, Jakarta D.K.I.",2019,4
mitsubishi xpander,245000000,mitsubishi,ULTIMATE A/T,Automatic,15.000-20.000,Bensin,"Klojen, Malang Kota, Jawa Timur",2019,4
mitsubishi xpander,247000000,mitsubishi,1.5 Cross Bensin,Automatic,10.000-15.000,Bensin,"Pondok Aren, Tangerang Selatan Kota, Banten",2019,3
mitsubishi xpander,219000000,mitsubishi,EXCEED M/T,Manual,10.000-15.000,Bensin,"Kediri Kota, Kediri Kota, Jawa Timur",2019,3
mitsubishi xpander,199000000,mitsubishi,1.5 Ultime Bensin,Automatic Triptonic,10.000-15.000,Bensin,"Kelapa Dua, Tangerang Kab., Banten",2019,3
mitsubishi xpander,265000000,mitsubishi,1.5 Ultimate Bensin,Automatic,0-5.000,Bensin,"Kediri Kota, Kediri Kota, Jawa Timur",2019,1
mitsubishi xpander,234000000,mitsubishi,1.5 Ultimate Bensin,Automatic,90.000-95.000,Bensin,"Jl Siliwangi No 66 Empang Bogor Selatan, Bogor Jawa Barat, RT 01/ RW 02, Nagrak, Kec. Sukaraja, Kota Bogor, Jawa Barat, 16132, Nagrak, Kec. Sukaraja, Bogor, Jawa BaratDapatkan petunjuk",2018,19
mitsubishi xpander,234000000,mitsubishi,1.5 Ultime Bensin,Automatic,90.000-95.000,Bensin,"Parung Panjang, Bogor Kab., Jawa Barat",2018,19
mitsubishi xpander,219000000,mitsubishi,1.5 Ultimate Bensin,Automatic,90.000-95.000,Bensin,"Tebet, Jakarta Selatan, Jakarta D.K.I.",2018,19
mitsubishi xpander,223000000,mitsubishi,ULTIMATE A/T,Automatic,85.000-90.000,Bensin,"Wonokromo, Surabaya Kota, Jawa Timur",2018,18
mitsubishi xpander,217000000,mitsubishi,1.5 Sport Bensin,Automatic,85.000-90.000,Bensin,"Gayungan, Surabaya Kota, Jawa Timur",2018,18
mitsubishi xpander,210000000,mitsubishi,SPORT A/T,Automatic,80.000-85.000,Bensin,"jl Ronggowarsito no 137 Timuran banjarsari Surakarta solo, Solo, Banjarsari, Solo, Jawa TengahDapatkan petunjuk",2018,17
mitsubishi xpander,209000000,mitsubishi,1.5 Ultimate Bensin,Automatic,80.000-85.000,Bensin,"Bursa Mobil Bintaro, Jl. Boulevard B7/B1, Bintaro Jaya Sektor 7, blok A19 dan A25, Pd. Jaya, Kecamatan Pd. Aren, Kecamatan Pondok Aren, Tanggerang Selatan, BantenDapatkan petunjuk",2018,17
mitsubishi xpander,197000000,mitsubishi,1.5 Exceed Bensin,Automatic,80.000-85.000,Bensin,"Jl Kembangan selatan no 10-11 Kembangan Jakbar, Kembangan, Kembangan, Jakarta Barat, DKI JakartaDapatkan petunjuk",2018,17
mitsubishi xpander,189900000,mitsubishi,1.5 Ultime Bensin,Automatic,80.000-85.000,Bensin,"Pancoran, Jakarta Selatan, Jakarta D.K.I.",2018,17
mitsubishi xpander,189900000,mitsubishi,1.5 Ultimate Bensin,Automatic,80.000-85.000,Bensin,"Jl. Tole Iskandar No 10. Kel. Sukamaju Kecamatan Cilodong Depok, Sukamaju, Kecamatan Cilodong, Kota Depok, Jawa BaratDapatkan petunjuk",2018,17
mitsubishi xpander,185000000,mitsubishi,1.5 GLS Bensin,Manual,70.000-75.000,Bensin,"Kenjeran, Surabaya Kota, Jawa Timur",2018,15
mitsubishi xpander,226000000,mitsubishi,1.5 Ultimate Bensin,Automatic,65.000-70.000,Bensin,"Pejaten Village Mall P-5, Jl. Warung Jati Barat, RT.1/RW.5, Jati Padang, Kecamatan Pasar Minggu, Jakarta Selatan, DKI JakartaDapatkan petunjuk",2018,14
mitsubishi xpander,227000000,mitsubishi,1.5 Ultimate Bensin,Automatic,60.000-65.000,Bensin,"Sidoarjo, Sidoarjo  Kab., Jawa Timur",2018,13
mitsubishi xpander,203000000,mitsubishi,SPORT A/T,Automatic,55.000-60.000,Bensin,"Sawahan, Surabaya Kota, Jawa Timur",2018,12
mitsubishi xpander,195000000,mitsubishi,EXCEED M/T,Manual,55.000-60.000,Bensin,"Duren Sawit, Jakarta Timur, Jakarta D.K.I.",2018,12
mitsubishi xpander,185000000,mitsubishi,GLS M/T,Manual,55.000-60.000,Bensin,"Sumobito, Jombang  Kab., Jawa Timur",2018,12
mitsubishi xpander,183000000,mitsubishi,GLS M/T,Manual,55.000-60.000,Bensin,"Lengkong, Bandung Kota, Jawa Barat",2018,12
mitsubishi xpander,220000000,mitsubishi,1.5 Ultimate Bensin,Automatic Triptonic,50.000-55.000,Bensin,"Bursa Mobil Mega Glodok Kemayoran (MGK) lt 3 Blok S 27 Jakarta Pusat, Kemayoran, Kemayoran, Jakarta Pusat, DKI JakartaDapatkan petunjuk",2018,11
mitsubishi xpander,218500000,mitsubishi,1.5 Sport Bensin,Automatic,50.000-55.000,Bensin,"Duren Sawit, Jakarta Timur, Jakarta D.K.I.",2018,11
mitsubishi xpander,215000000,mitsubishi,1.5 Ultimate Bensin,Automatic,50.000-55.000,Bensin,"Kartoharjo, Madiun Kota, Jawa Timur",2018,11
mitsubishi xpander,243000000,mitsubishi,1.5 Ultimate Bensin,Automatic,45.000-50.000,Bensin,"Gubeng, Surabaya Kota, Jawa Timur",2018,10
mitsubishi xpander,220000000,mitsubishi,1.5 Sport Bensin,Automatic,45.000-50.000,Bensin,"Pejaten Village Mall P-5, Jl. Warung Jati Barat, RT.1/RW.5, Jati Padang, Kecamatan Pasar Minggu, Jakarta Selatan, DKI JakartaDapatkan petunjuk",2018,10
mitsubishi xpander,215000000,mitsubishi,EXCEED A/T,Automatic,45.000-50.000,Bensin,"Gubeng, Surabaya Kota, Jawa Timur",2018,10
mitsubishi xpander,207000000,mitsubishi,1.5 Exceed Bensin,Manual,45.000-50.000,Bensin,"Kediri Kota, Kediri Kota, Jawa Timur",2018,10
mitsubishi xpander,205000000,mitsubishi,1.5 GLS Bensin,Automatic,45.000-50.000,Bensin,"Blimbing, Malang Kota, Jawa Timur",2018,10
mitsubishi xpander,229000000,mitsubishi,1.5 Ultimate Bensin,Automatic,40.000-45.000,Bensin,"Mall Tamini Square Basement Zona D, Jl. Taman Mini I No.1, RW.2, Pinang Ranti, Kec. Makasar, Kota Jakarta Timur, Daerah Khusus Ibukota Jakarta 13560, Pinang Ranti, Makasar, Jakarta Timur, DKI JakartaDapatkan petunjuk",2018,9
mitsubishi xpander,222000000,mitsubishi,ULTIMATE A/T,Automatic,40.000-45.000,Bensin,"Gubeng, Surabaya Kota, Jawa Timur",2018,9
mitsubishi xpander,215000000,mitsubishi,1.5 Sport Bensin,Automatic,40.000-45.000,Bensin,"Mulyorejo, Surabaya Kota, Jawa Timur",2018,9
mitsubishi xpander,213000000,mitsubishi,ULTIMATE A/T,Automatic,40.000-45.000,Bensin,"Pademangan, Jakarta Utara, Jakarta D.K.I.",2018,9
mitsubishi xpander,220000000,mitsubishi,ULTIMATE A/T,Automatic,35.000-40.000,Bensin,"Ruko simpang tiga, Jl gusdur, Blk. D2, Weru, Mojongapit, Kec. Jombang, Kabupaten Jombang, Jawa Timur 61413, Mojongapit, Kab. Jombang, Kec. Jombang, Jawa TimurDapatkan petunjuk",2018,8
mitsubishi xpander,219000000,mitsubishi,EXCEED A/T,Automatic,35.000-40.000,Bensin,"Gubeng, Surabaya Kota, Jawa Timur",2018,8
mitsubishi xpander,230000000,mitsubishi,1.5 Ultime Bensin,Automatic,30.000-35.000,Bensin,"Lemahabang, Karawang Kab., Jawa Barat",2018,7
mitsubishi xpander,228000000,mitsubishi,1.5 Ultimate Bensin,Automatic,30.000-35.000,Bensin,"Jl. Raya Karanglo No.69, Karanglo, Banjararum, Kec. Singosari, Kabupaten Malang, Jawa Timur 65153, Singosari, Malang Kec Singosari, Malang, Jawa TimurDapatkan petunjuk",2018,7
mitsubishi xpander,225000000,mitsubishi,ULTIMATE A/T,Automatic,30.000-35.000,Bensin,"Pamulang, Tangerang Selatan Kota, Banten",2018,7
mitsubishi xpander,215000000,mitsubishi,ULTIMATE A/T,Automatic,30.000-35.000,Bensin,"Pulo Gadung, Jakarta Timur, Jakarta D.K.I.",2018,7
mitsubishi xpander,212000000,mitsubishi,EXCEED A/T,Automatic,25.000-30.000,Bensin,"Astana Anyar, Bandung Kota, Jawa Barat",2018,6
mitsubishi xpander,198000000,mitsubishi,1.5 Sport Bensin,Automatic,205.000-210.000,Bensin,"Jl. Cempaka Putih Tengah II No.16, RT.: 01/RW.: 05, Cempaka Putih Timur, Kecamatan Cempaka Putih, Jakarta Pusat, DKI JakartaDapatkan petunjuk",2018,42
mitsubishi xpander,235000000,mitsubishi,1.5 Ultime Bensin,Automatic,20.000-25.000,Bensin,"Rungkut, Surabaya Kota, Jawa Timur",2018,5
mitsubishi xpander,235000000,mitsubishi,1.5 Ultimate Bensin,Automatic,15.000-20.000,Bensin,"Jl. Ahmad Yani, Karangkidul, Kec. Semarang Tengah, Kota Semarang, Jawa Tengah 50242, Karangkidul, Kec. Semarang Tengah, Kota Semarang, Jawa TengahDapatkan petunjuk",2018,4
mitsubishi xpander,210000000,mitsubishi,1.5 Sport Bensin,Automatic Triptonic,15.000-20.000,Bensin,"Semarang Barat, Semarang Kota, Jawa Tengah",2018,4
mitsubishi xpander,180000000,mitsubishi,1.5 GLS Bensin,Manual,15.000-20.000,Bensin,"Jl. Raden Saleh No.25, RT.5/RW.1, Meruya Utara, Kecamatan Kembangan, Jakarta Barat, DKI JakartaDapatkan petunjuk",2018,4
mitsubishi xpander,224000000,mitsubishi,1.5 Ultimate Bensin,Automatic,105.000-110.000,Bensin,"Blimbing, Malang Kota, Jawa Timur",2018,22
